model/model_metrics.json

[
    {
        "ML Model Name": "Logistic Regression",
        "Accuracy": 0.9649122807017544,
        "AUC": 0.996031746031746,
        "Precision": 0.975,
        "Recall": 0.9285714285714286,
        "F1": 0.9512195121951219,
        "MCC": 0.9245181185940877
    },
    {
        "ML Model Name": "Decision Tree",
        "Accuracy": 0.9298245614035088,
        "AUC": 0.9246031746031745,
        "Precision": 0.9047619047619048,
        "Recall": 0.9047619047619048,
        "F1": 0.9047619047619048,
        "MCC": 0.8492063492063492
    },
    {
        "ML Model Name": "KNN",
        "Accuracy": 0.956140350877193,
        "AUC": 0.982308201058201,
        "Precision": 0.9743589743589743,
        "Recall": 0.9047619047619048,
        "F1": 0.9382716049382716,
        "MCC": 0.9058238738943076
    },
    {
        "ML Model Name": "Naive Bayes",
        "Accuracy": 0.9210526315789473,
        "AUC": 0.9890873015873015,
        "Precision": 0.9230769230769231,
        "Recall": 0.8571428571428571,
        "F1": 0.8888888888888888,
        "MCC": 0.8291617197562593
    },
    {
        "ML Model Name": "Support Vector Machine",
        "Accuracy": 0.9736842105263158,
        "AUC": 0.9947089947089947,
        "Precision": 1.0,
        "Recall": 0.9285714285714286,
        "F1": 0.9629629629629629,
        "MCC": 0.9441549509633318
    }
]

README.md

### Model Observations

Achieved an accuracy of 96.49% and an AUC of 99.60%. It demonstrated excellent classification performance with a high precision of 97.50% and recall of 92.86%. It is the second-best overall model based on F1 Score.

**Decision Tree
Achieved an accuracy of 92.98% and an F1 Score of 90.48%. It provided reasonable classification performance but performed lower than the other models on most evaluation metrics.

Achieved an accuracy of 95.61% and an AUC of 98.23%. It showed good classification performance with 97.44% precision and 93.83% F1 Score. It performed better than Decision Tree and Naive Bayes.

Achieved an accuracy of 92.11% and an AUC of 98.91%. Although it achieved a good AUC score, its recall of 85.71% and F1 Score of 88.89% were comparatively lower.

Achieved the highest accuracy of 97.37%, precision of 100%, F1 Score of 96.30% and MCC of 0.9442. It demonstrated the best overall classification performance among the five models.

Although Logistic Regression achieved the highest AUC score of 0.9960, SVM performed better across most of the other evaluation metrics.